N;Funding Year;Línea de Investigación;Research Lines;Año;Autores;Título;Revista;Ficha de Publicación;DOI;ISSN;Abstract;Acceso;Páginas;Volumen;Index
175.0;2017;Biogeoquímica;BGQ;2017;Carrasco, C., Karstensen, J., & Farias, L.;On the Nitrous Oxide Accumulation in Intermediate Waters of the Eastern South Pacific Ocean;Frontiers in Marine Science;;10.3389/fmars.2017.00024;2296-7745;Nitrous oxide (N2O) is a powerful greenhouse gas principally produced by nitrification and denitrification in the marine environment. Observations were made in the eastern South Pacific (ESP), between 10° and 60°S, and ~75°–88°W, from intermediate waters targeting Antarctic Intermediate Water (AAIW) at potential density of 27.0–27.1 kg m−3. Between 60° and 20°S, a gradual equatorward increase of N2O from 8 to 26 nmol L−1 was observed at density 27.0–27.1 kg m−3 where AAIW penetrates. Positive correlations were found between apparent N2O production (ΔN2O) and O2 utilization (AOU), and between ΔN2O and NO−3NO3−, which suggested that local N2O production is predominantly produced by nitrification. Closer to the equator, between 20° and 10°S at AAIW core, a strong N2O increase up to 75 nmol L−1 was observed. Because negative correlations were found between ΔN2O vs. NO−3NO3− and ΔN2O vs. N* (a Nitrogen deficit index) and because ΔN2O and AOU do not follow a linear trend, we suspect that, in addition to nitrification, denitrification also takes place in N2O cycling. By making use of water mass mixing analyses, we show that an increase in N2O occurs in the region where high oxygen from AAIW merges with low oxygen from Equatorial Subsurface Water (ESSW), creating favorable conditions for local N2O production. We conclude that the non-linearity in the relationship between N2O and O2 is a result of mixing between two water masses with very different source characteristics, paired with the different time frames of nitrification and denitrification processes that impact water masses en route before they finally meet and mix in the ESP region.;http://journal.frontiersin.org/article/10.3389/fmars.2017.00024/full;art24;vol.4;Scopus
176.0;2017;Dimensión Humana;HD;2017;Moraga Sariego, P.;La Definición de Nuevos Estándares en Materia de Participación Ciudadana en el Sistema de Evaluación de Impacto Ambiental;Revista Derecho del Estado;;;2346-2051;La Ley 19.300 sobre Bases Generales del Medio Ambiente del año 1994, brindó el primer marco legal para la protección ambiental en el país, en el contexto de la Cumbre de Río realizada dos años antes. Luego de las recomendaciones efectuadas por la OCDE en el sentido de fortalecer la institucionalidad ambiental (2005), el legislador dicta la Ley N°20.417 que introduce la reforma ambiental (2010) y la Ley N°20.600 que crea los Tribunales Ambientales (2012). La primera amplía el ámbito de aplicación de la participación ciudadana del sistema de evaluación de impacto ambiental, sin embargo es el trabajo jurisprudencial del Segundo Tribunal Ambiental el que permitirá comprender el real alcance de la modificación legislativa. Esta judicatura especializada  desarrolla nuevos estándares de participación ciudadana en el marco del proyecto de la Empresa de Ferrocarriles del Estado. Se trata de una interpretación amplia del principio en miras a una aplicación real y no únicamente formal del mismo, lo que contribuye al fortalecimiento de esta institución en relación al principio de acceso a la información y a la justicia en materia ambiental.;http://revistas.uexternado.edu.co/index.php/derest/article/view/4773;;is.38;Scopus, ScieLO y Latindex
177.0;2017;Modelación y Sistemas de Observación;MOS;2017;de la Fuente, A., Rojas, M., Mac-Lean, C.;A human-scale perspective on global warming: Zero emission year and personal quotes;PloS one;;10.1371/journal.pone.0179705;1932-6203;"This article builds on the premise that human consumption of goods, food and transport are the ultimate drivers of climate change. However, the nature of the climate change problem (well described as a tragedy of the commons) makes it difficult for individuals to recognise their personal duty to implement behavioural changes to reduce greenhouse gas emissions. Consequently, this article aims to analyse the climate change issue from a human-scale perspective, in which each of us has a clearly defined personal quota of CO2 emissions that limits our activity and there is a finite time during which CO2  emissions must be eliminated to achieve the “well below 2 °C” warming limit set by the Paris Agreement of 2015 (COP21). Thus, this work’s primary contribution is to connect an  equal per capita fairness approach to a global carbon budget, linking personal levels with planetary levels. Here, we show that a personal quota of 5.0 tons of CO 2 yr -1 p -1 is a representative value for both past and future emissions; for this level of a constant per capita emissions and without considering any mitigation, the global accumulated emissions compatible with the “well below 2 °C” and 2 °C targets will be exhausted by 2030 and 2050, respectively. These are references years that provide an order of magnitude of the time that is left to reverse the global warming trend. More realistic scenarios that consider a smooth transition toward a zero-emission world show that the global accumulated emissions compatible with the “well below 2 °C” and 2 °C targets will be exhausted by 2040 and 2080, respectively. Implications of this paper include a return to personal responsibility following equity principles among individuals, and a definition of boundaries to the personal emissions of CO2 .";http://journals.plos.org/plosone/article?id=10.1371/journal.pone.0179705;1-29;vol.12;Thomson Reuters ISI
178.0;2017;Modelación y Sistemas de Observación;MOS;2017;Escribano, J., Boucher, O., Chevallier, F., Huneeus, N.;Impact of the choice of the satellite aerosol optical depth product in a sub-regional dust emission inversion;Atmospheric Chemistry and Physics;;10.5194/acp-17-7111-2017;1680-7316;Mineral dust is the major continental contributor to the global atmospheric aerosol burden with important effects on the climate system. Regionally, a large fraction of the emitted dust is produced in North Africa, however the total emission flux from this region is still highly uncertain. In order to reduce these uncertainties, emission estimates through top-down approaches (i.e., usually models constrained by observations) had been successfully developed and implemented. Such studies usually rely on a single observational dataset and propagate the possible observational errors of this dataset onto the emission estimates. In this study, aerosol optical depth (AOD) products from five different satellites are assimilated one by one in a source inversion system to estimate dust emission fluxes over northern Africa and the Arabian Peninsula. We estimate mineral dust emissions for the year 2006 and discuss the impact of the assimilated dataset on the analysis. We find a relatively large dispersion in flux estimates among the five experiments, which can likely be attributed to differences in the assimilated observation datasets and their associated error statistics. We also show how the assimilation of a variety of AOD products can help to identify systematic errors in models.;http://www.atmos-chem-phys.net/17/7111/2017/;1-22;vol.17;Thomson Reuters ISI
179.0;2017;Servicios Ecosistémicos;ECO;2017;Ortega-Solís, G., Díaz, I., Mellado-Mansilla, D., Tello, F., Moreno, R., Tejo,  C.;Ecosystem engineering by Fascicularia bicolor in the canopy of the South-American temperate rainforest;Forest Ecology and Management;;10.1016/j.foreco.2017.06.020;417-428;"Ecosystem engineers are organisms that modify habitats and resource flows, they therefore could have a disproportionate impact on the diversity of ecological communities. Evidence suggests that trash basket epiphytes (TBE) can be considered ecosystem engineers of forest canopies, due to their relationship with arboreal soil availability and treetop communities. Here we evaluated whether the TBE Fascicularia bicolor (Bromeliaceae), modulates temperature and humidity in the forest canopy. We also investigated if this bromeliad is related with greater arboreal soil accumulation and is associated to higher diversity of other epiphytic plants and invertebrates in the canopy of the South-American temperate rainforest (SATR), in Chile. We measured temperature and humidity in ten trees within the forest before and after the experimental addition of F. bicolor. We also related the presence of F. bicolor with occurrence of soil macrofauna and other canopy dwelling plants in a comparative field survey.
Temperature variability in the canopy was reduced by F. bicolor. Soil availability was higher in siteswith mats of F. bicolor. The richness of vascular epiphytes was unaltered by the presence of F. bicolor,but species composition differed between sites with and without mats on each tree. At the group level,the cover of lichens and bryophytes was greater in sites without F. bicolor, while vascular epiphytes showa larger cover in sites with F. bicolor. The species richness of invertebrates increased in treetop sites colonized by F. bicolor but species composition was not different from soil in branch bifurcations. Our resultsshow that F. bicolor must be considered in forest management practices to determine which trees must belogged, in order to preserve the viability of populations of these key organisms in the treetops of South-American temperate rainforests.";http://linkinghub.elsevier.com/retrieve/pii/S0378112717302074;417-428;vol.400;Thomson Reuters ISI
181.0;2017;Modelación y Sistemas de Observación;MOS;2017;Barraza, F., Lambert, F., Jorquera, H., Villalobos, A. M., Gallardo, L.;Temporal evolution of main ambient PM 2.5 sources in Santiago, Chile, from 1998 to 2012;Atmospheric Chemistry and Physics Discussions;"<a href=""http://bit.ly/2HJbndE"">Ver ficha</a>";10.5194/acp-2017-18;1680-7375;"The inhabitants of Santiago in Chile have been exposed to harmful levels of air pollutants for decades. The city’s poor air quality is a result of sustained emissions and stable atmospheric conditions, averse to mixing and ventilation and favorable for the formation of oxidants and secondary aerosols. Identifying and quantifying the sources that contribute to the ambient levels of pollutants is key for designing adequate mitigation measures. Knowledge about the temporal evolution of the contribution of each source to ambient pollution levels is also paramount to evaluate the effectiveness of pollution reduction measures that have been implemented in the past decades. Here, we quantify the main sources that have contributed to fine
particulate matter (PM 2.5 ) between 1998 and 2012 in Santiago’s center by using two different source-receptor models (PMF 5.0 and Unmix 6.0), that re applied to elemental measurements on 1243 24-hour filter samples of ambient PM 2.5 collected between April-1998 to August-2012. Both models resolve six sources that contribute to ambient PM 2.5 : motor vehicles (37%), industrial sources (19%), copper smelters (14%), wood burning (12%), coastal sources (10%), and urban dust (3%).
Our results show that over the 15 years analyzed here, the emissions from motor vehicles, industrial sources, copper
smelters, and coastal sources declined by about 21, 39, 81, 59, and 59% respectively, while wood burning didn’t change and urban dust increase by 72%. These changes are consistent with emission reduction measures, such as improved vehicle and smelting technology, introduction of low sulfur fuel for vehicles and natural gas for industrial processes, emission controls for vehicles, public transport improvements etc.. However, it is also apparent that the mitigation expected from improved public transport, vehicle technology, and fuel has been largely nullified by the ever-rising number of private vehicle journeys in the past decade. As a consequence, Santiago still experiences PM 2.5 levels above the annual and 24-hours Chilean and World Health Organization standards";http://www.atmos-chem-phys-discuss.net/acp-2017-18/;1-21;vol. in press;Thomson Reuters ISI
182.0;2017;Dinámica del clima, MOS;CD, MOS;2017;González-Reyes, A., McPhee, J., Christie, D. A., Le Quesne, C., Szejner, P., Masiokas, M. H., Villalba, R., Muñoz, A. A., Crespo, S.;Spatio-temporal variations in hydroclimate across the Mediterranean Andes (30°-37°S) since the early 20th century;Journal of Hydrometeorology;;10.1175/JHM-D-16-0004.1;1525-755X;"In the Mediterranean Andes (MA; 30°S–37°S), the main rivers are largely fed by melting snowpack and provide fresh water to around 10 million people on both sides of the Cordillera. Water resources in the MA are under pressure due to the extensive development of industrial agriculture and mining activities. This pressure is increasing as the region faces one of its worst recorded droughts. Previous studies have pointed to the El Niño Southern Oscillation (ENSO) as the main climatic force impacting the MA. However, the role of decadal and multidecadal climate variability, their spatial patterns and the recurrence of long-term droughts, remains poorly studied. In this contribution to a better understanding of these factors, spatial and temporal patterns of hydroclimatic variability are analyzed using an extensive database of streamflow, precipitation, and snowpack covering the period between 1910 – 2011. These analyses are based on the combination of correlation, principal components and kernel-estimation techniques. Despite a general common pattern across the MA region, our results identify two hydroclimatic sub-regions, located north and south of 34°S. While the interannual variability associated with ENSO is slightly stronger north of 34°S, the variability associated with the Pacific Decadal Oscillation (PDO) and/or the Inter-decadal Pacific Oscillation index (IPO) shows similar patterns in both regions. However, variations produced by the IPO forcing seem to be greater in the southern sub-region since 1975. Our estimations on drought recurrence reveal a generalized increase in dry extremes since the 1950’s. These findings suggest that the northern MA are more vulnerable to changes in hydrology and climate than the southern MA.";http://journals.ametsoc.org/doi/10.1175/JHM-D-16-0004.1;1-44;vol. in press;Thomson Reuters ISI
183.0;2017;Dinámica del clima;CD;2017;Guimberteau, M., Ciais, M., Ducharne, A., Boisier, J. P., Dutra Aguiar A. P., Biemans, H., De Deurwaerder, H., Galbraith, D., Kruijt, B., Langerwisch, F., Poveda, G., Rammig, A., Rodriguez, D. A., Tejada, G., Thonicke, K., Von Randow, C., Von Randow, R. C. S., Zhang, K., Verbeeck, H.;Impacts of future deforestation and climate change on the hydrology of the Amazon Basin: a multi-model analysis with a new set of land-cover change scenarios;Hydrology and Earth System Sciences;;10.5194/hess-21-1455-2017;1027-5606;Deforestation in Amazon is expected to decrease evapotranspiration (ET) and to increase soil moisture and river discharge under prevailing energy-limited conditions. The magnitude and sign of the response of ET to deforestation depend both on the magnitude and regional patterns of land-cover change (LCC), as well as on climate change and CO2 levels. On the one hand, elevated CO2 decreases leaf-scale transpiration, but this effect could be offset by increased foliar area density. Using three regional LCC scenarios specifically established for the Brazilian and Bolivian Amazon, we investigate the impacts of climate change and deforestation on the surface hydrology of the Amazon Basin for this century, taking 2009 as a reference. For each LCC scenario, three land surface models (LSMs), LPJmL-DGVM, INLAND-DGVM and ORCHIDEE, are forced by bias-corrected climate simulated by three general circulation models (GCMs) of the IPCC 4th Assessment Report (AR4). On average, over the Amazon Basin with no deforestation, the GCM results indicate a temperature increase of 3.3 °C by 2100 which drives up the evaporative demand, whereby precipitation increases by 8.5 %, with a large uncertainty across GCMs. In the case of no deforestation, we found that ET and runoff increase by 5.0 and 14 %, respectively. However, in south-east Amazonia, precipitation decreases by 10 % at the end of the dry season and the three LSMs produce a 6 % decrease of ET, which is less than precipitation, so that runoff decreases by 22 %. For instance, the minimum river discharge of the Rio Tapajós is reduced by 31 % in 2100. To study the additional effect of deforestation, we prescribed to the LSMs three contrasted LCC scenarios, with a forest decline going from 7 to 34 % over this century. All three scenarios partly offset the climate-induced increase of ET, and runoff increases over the entire Amazon. In the south-east, however, deforestation amplifies the decrease of ET at the end of dry season, leading to a large increase of runoff (up to +27 % in the extreme deforestation case), offsetting the negative effect of climate change, thus balancing the decrease of low flows in the Rio Tapajós. These projections are associated with large uncertainties, which we attribute separately to the differences in LSMs, GCMs and to the uncertain range of deforestation. At the subcatchment scale, the uncertainty range on ET changes is shown to first depend on GCMs, while the uncertainty of runoff projections is predominantly induced by LSM structural differences. By contrast, we found that the uncertainty in both ET and runoff changes attributable to uncertain future deforestation is low.;http://www.hydrol-earth-syst-sci.net/21/1455/2017/;1455-1475;vol.21;Thomson Reuters ISI
184.0;2017;Biogeoquímica;BGQ;2017;Joly, D., Santoro, C. M., Gayo, E. M., Ugalde, P.C., March, R. J., Carmona, R., Marguerie, D., Latorre, C.;Late Pleistocene Fuel Management and Human Colonization of the Atacama Desert, Northern Chile;Latin American Antiquity;;10.1017/laq.2016.8;1045-6635, 2325-5080;"Hunter-gatherers collected and used various woody species depending on the landscape, availability of plant communities, and sociocultural considerations. With extensive paleo-wetlands and groundwater-fed oases, the Atacama Desert was interspersed with riparian woodlands that provided vital resources (fuel, water, and game) at the end of the Pleistocene in areas such as the Pampa del Tamarugal (PdT) basin. We use anthracological analyses to determine the fuel management strategies of hunter-gatherer societies in this hyperarid environment and explore whether the “Principle of Least Effort” applies. First, we present the combustion qualities and characteristics of woody taxa from the Atacama and analyze possible exploitation strategies. Second, we use anthracological analyses from Quebrada Maní 12 (QM12), a late Pleistocene archaeological site (dated from 12,750 to 11,530 cal B.P.) located in the PdT basin, to show the prevalence of two woody species that were either freshly collected or gathered (very likely on purpose) from subfossil wood. Our results suggest that fuel selection strategies were based on prior knowledge of the qualities of these woody taxa and how they burned. Thus we conclude that fuel management was part of a number of social and economic decisions that allowed for effective colonization of this region. Furthermore, we stress the need for caution when using charcoal to exclusively date archaeological sites located in desert environments.
, 
Hunter-gatherers collected and used various woody species depending on the landscape, availability of plant communities, and sociocultural considerations. With extensive paleo-wetlands and groundwater-fed oases, the Atacama Desert was interspersed with riparian woodlands that provided vital resources (fuel, water, and game) at the end of the Pleistocene in areas such as the Pampa del Tamarugal (PdT) basin. We use anthracological analyses to determine the fuel management strategies of hunter-gatherer societies in this hyperarid environment and explore whether the “Principle of Least Effort” applies. First, we present the combustion qualities and characteristics of woody taxa from the Atacama and analyze possible exploitation strategies. Second, we use anthracological analyses from Quebrada Maní 12 (QM12), a late Pleistocene archaeological site (dated from 12,750 to 11,530 cal B.P.) located in the PdT basin, to show the prevalence of two woody species that were either freshly collected or gathered (very likely on purpose) from subfossil wood. Our results suggest that fuel selection strategies were based on prior knowledge of the qualities of these woody taxa and how they burned. Thus we conclude that fuel management was part of a number of social and economic decisions that allowed for effective colonization of this region. Furthermore, we stress the need for caution when using charcoal to exclusively date archaeological sites located in desert environments.
, 
Las sociedades de cazadores-recolectores del Cono Sur recolectaron y utilizaron diversas especies leñosas dependiendo de las condiciones del paisaje, las comunidades de plantas disponibles y consideraciones socio-culturales. Las cuencas hidrográficas, como Pampa del Tamarugal (PdT) en el Desierto de Atacama, contaban con extensos paleo-humedales y oasis sustentados con aguas subterráneas, intercalados con bosques ribereños que proporcionaron recursos vitales (combustible, agua y caza) hacia finales del Pleistoceno. Este estudio utiliza análisis antracológicos para definir las estrategias empleadas por los grupos de cazadores-recolectores para la gestión del combustible en este ambiente híper árido y explorar si dicho comportamiento social puede ser explicado por el “principio del menor esfuerzo”. En primer lugar, se presentan las cualidades y características de quema de los taxones leñosos del Desierto de Atacama y un análisis de sus estrategias de explotación. En segundo lugar, se utilizan los resultados de análisis antracológicos de muestras de carbones y maderas del sitio arqueológico Quebrada Maní 12 (QM12), ubicado en la PdT y asignado al Pleistoceno tardío (datado entre 12.750 y 11.530 cal a.P.). Estos muestran un predominio de dos especies leñosas recogidas como madera fresca ocolectadas, posiblemente en forma intencional, como “madera vieja”. Los resultados revelan que las estrategias de selección del material para la combustión requirieron de un conocimiento previo acerca de cómo se quemaban los taxones leñosos. Consecuentemente, se concluye que la gestión del combustible formó parte de las decisiones sociales y económicas que permitieron una colonización efectiva de esta región. Finalmente, se señala la necesidad de cautela a la hora de interpretar las cronologías arqueológicas basadas exclusivamente en dataciones sobre carbón en sitios ubicados en desiertos.";https://www.cambridge.org/core/journals/latin-american-antiquity/article/late-pleistocene-fuel-management-and-human-colonization-of-the-atacama-desert-northern-chile/148EDD42FFCA1DCAB84016CAA880F81D;144-160;vol.28;Thomson Reuters AHCI
185.0;2017;Modelación y Sistemas de Observación;MOS;2017;Anet, J. G., Steinbacher, M., Gallardo, L., Velásquez Álvarez, P. A., Emmenegger,  L., Buchmann, B.;Surface ozone in the Southern Hemisphere: 20 years of data from a site with a unique setting in El Tololo, Chile;Atmospheric Chemistry and Physics;;10.5194/acp-17-6477-2017;1680-7324;"The knowledge of surface ozone mole fractions and their global distribution is of utmost importance due to the impact of ozone on human health and ecosystems and the central role of ozone in controlling the oxidation capacity of the troposphere. The availability of long-term ozone records is far better in the Northern than in the Southern Hemisphere, and recent analyses of the seven accessible records in the Southern Hemisphere have shown inconclusive trends. Since late 1995, surface ozone is measured in situ at ""El Tololo"", a high-altitude (2200 m a.s.l.) and pristine station in Chile (30° S, 71° W). The dataset has been recently fully quality controlled and reprocessed. This study presents the observed ozone trends and annual cycles and identifies key processes driving these patterns. From 1995 to 2010, an overall positive trend of  ∼  0.7 ppb decade−1 is found. Strongest trends per season are observed in March and April. Highest mole fractions are observed in late spring (October) and show a strong correlation with ozone transported from the stratosphere down into the troposphere, as simulated with a model. Over the 20 years of observations, the springtime ozone maximum has shifted to earlier times in the year, which, again, is strongly correlated with a temporal shift in the occurrence of the maximum of simulated stratospheric ozone transport at the site. We conclude that background ozone at El Tololo is mainly driven by stratospheric intrusions rather than photochemical production from anthropogenic and biogenic precursors. The major footprint of the sampled air masses is located over the Pacific Ocean. Therefore, due to the negligible influence of local processes, the ozone record also allows studying the influence of El Niño and La Niña episodes on background ozone levels in South America. In agreement with previous studies, we find that, during La Niña conditions, ozone mole fractions reach higher levels than during El Niño conditions.";http://www.atmos-chem-phys.net/17/6477/2017/;6477-6492;vol.17;Thomson Reuters ISI
