N;Funding Year;Línea de Investigación;Research Lines;Año;Autores;Título;Revista;Ficha de Publicación;DOI;ISSN;Abstract;Acceso;Páginas;Volumen;Index
247.0;2018;Ciudades Resilientes;Ciudades;2018;Flores, C., Gayo, E. M., Salazar, D., Broitman, B. R.;δ 18 O of Fissurella maxima as a proxy for reconstructing Early Holocene sea surface temperatures in the coastal Atacama desert (25°S);Palaeogeography, Palaeoclimatology, Palaeoecology;;10.1016/j.palaeo.2018.03.031;0031-0182;Fissurella maxima is a keyhole limpet that is abundant and well preserved in archaeological shell midden sites along the coast of Chile, making it an appropriate species to use for reconstructions of past sea surface temperature (SST). In the present study we evaluate the potential of F. maxima shells as a proxy of SST by analysing δ18O of modern shells collected alive from the Atacama desert (area of Taltal, 25°S) and archaeological shells from two Early Holocene rockshelter sites: 224A and Paposo Norte 9. Reconstructed SST from modern F. maxima shells were related to SST obtained from in situ thermometers, supporting the use of this mollusc species as a paleotemperature archive. Mean SST reconstructed from Early Holocene archaeological shells (14.13 °C) was 2.86 °C cooler than mean temperature recorded in modern shells (16.99 °C). Mean SST reconstructed from modern shells was ~1.04 °C warmer than the mean temperature of in situ thermometers (15.95°C). Hence the paleo–SST data from archaeological sites 224A and Paposo Norte 9 enrich the Early Holocene nearshore paleoceanographic scenario of the Pacific coast of South America, with mean SST cooler than present-day SST. Our results validate the use of F. maxima shells as a SST proxy and contribute to a better understanding of the latitudinal distribution of the coastal upwelling regime during the Early Holocene, temporal changes in the structure of the Humboldt Current along the Holocene, and its influence on human adaptation through the prehistory of South America.;http://linkinghub.elsevier.com/retrieve/pii/S003101821730874X;22-34;vol.499;Thomson Reuters ISI
248.0;2018;Ciudades Resilientes;Ciudades;2018;Freeman, J., 1, Baggio, J.A., Robinson, E., Byers, D.A., Gayo, E., Finley, J.B., Meyer, J., Kelly, R.L., Anderies, J.M.;Synchronization of energy consumption by human societies throughout the Holocene;Proceedings of the National Academy of Sciences;;10.1073/pnas.1802859115;0027-8424;We conduct a global comparison of the consumption of energy by human populations throughout the Holocene and statistically quantify coincident changes in the consumption of energy over space and time—an ecological phenomenon known as synchrony. When populations synchronize, adverse changes in ecosystems and social systems may cascade from society to society. Thus, to develop policies that favor the sustained use of resources, we must understand the processes that cause the synchrony of human populations. To date, it is not clear whether human societies display long-term synchrony or, if they do, the potential causes. Our analysis begins to fill this knowledge gap by quantifying the long-term synchrony of human societies, and we hypothesize that the synchrony of human populations results from (i) the creation of social ties that couple populations over smaller scales and (ii) much larger scale, globally convergent trajectories of cultural evolution toward more energy-consuming political economies with higher carrying capacities. Our results suggest that the process of globalization is a natural consequence of evolutionary trajectories that increase the carrying capacities of human societies.;http://www.pnas.org/lookup/doi/10.1073/pnas.1802859115;9962-9967;vol.115 is.40;Thomson  Reuters ISI
249.0;2018;Zonas Costeras;Costas;2018;Fuentes, S., Arroyo, J.I., Rodríguez-Marconi, S., Masotti, I., Alarcón-Schumacher, T., Polz, M.F., Trefault, N., de la Iglesia, R., Díez, B.;Summer phyto- and bacterioplankton communities during low and high productivity scenarios in the Western Antarctic Peninsula;Polar Biology;;10.1007/s00300-018-2411-5;0722-4060;"Phytoplankton blooms taking place during the warm season drive high productivity in Antarctic coastal seawaters. Important temporal and spatial variations exist in productivity patterns, indicating local constraints influencing the phototrophic community. Surface water in Chile Bay (Greenwich Island, South Shetlands) is influenced by freshwater from the melting of sea ice and surrounding glaciers; however, it is not a widely studied system. The phyto- and bacterioplankton communities in Chile Bay were studied over two consecutive summers; during a low productivity period (chlorophyll a &lt; 0.05 mg m−3) and an ascendant phototrophic bloom (chlorophyll a up to 2.38 mg m−3). Microbial communities were analyzed by 16S rRNA—including plastidial—gene sequencing. Diatoms (mainly Thalassiosirales) were the most abundant phytoplankton, particularly during the ascendant bloom. Bacterioplankton in the low productivity period was less diverse and dominated by a few operational taxonomic units (OTUs), related to Colwellia and Pseudoalteromonas. Alpha diversity was higher during the bloom, where several Bacteroidetes taxa absent in the low productivity period were present. Network analysis indicated that phytoplankton relative abundance was correlated with bacterioplankton phylogenetic diversity and the abundance of several bacterial taxa. Hubs—the most connected OTUs in the network—were not the most abundant OTUs and included some poorly described taxa in Antarctica, such as Neptunomonas and Ekhidna. In summary, the results of this study indicate that in Antarctic Peninsula coastal waters, such as Chile Bay, higher bacterioplankton community diversity occurs during a phototrophic bloom. This is likely a result of primary production, providing a source of fresh organic matter to bacterioplankton. © 2018, Springer-Verlag GmbH Germany, part of Springer Nature.";http://link.springer.com/10.1007/s00300-018-2411-5;;;Thomson  Reuters ISI
250.0;2018;"Ciudades Resilientes; Gobernanza e Interfaz entre Ciencia y Política, Cambio de Uso de Suelo";"Gobernanza; Ciudades; Suelo";2018;Gallardo, L., Barraza, F., Ceballos, A., Galleguillos, M., Huneeus, N., Lambert, F., Ibarra, C., Munizaga, M., O'Ryan, R., Osses, M.,Tolvett, S., Urquiza, A., Véliz, K.;Evolution of air quality in Santiago: The role of mobility and lessons from the science-policy interface;Elementa: Science of the Anthropocene;;10.1525/elementa.293;2325-1026;Worldwide, urbanization constitutes a major and growing driver of global change and a distinctive feature of the Anthropocene. Thus, urban development paths present opportunities for technological and societal transformations towards energy efficiency and decarbonization, with benefits for both greenhouse gas (GHG) and air pollution mitigation. This requires a better understanding of the intertwined dynamics of urban energy and land use, emissions, demographics, governance, and societal and biophysical processes. In this study, we address several characteristics of urbanization in Santiago (33.5°S, 70.5°W, 500 m a.s.l.), the capital city of Chile. Specifically, we focus on the multiple links between mobility and air quality, describe the evolution of these two aspects over the past 30 years, and review the role scientific knowledge has played in policy-making. We show evidence of how technological measures (e.g., fuel quality, three-way catalytic converters, diesel particle filters) have been successful in decreasing coarse mode aerosol (PM10) concentrations in Santiago despite increasing urbanization (e.g., population, motorization, urban sprawl). However, we also show that such measures will likely be insufficient if behavioral changes do not achieve an increase in the use of public transportation. Our investigation seeks to inform urban development in the Anthropocene, and our results may be useful for other developing countries, particularly in Latin America and the Caribbean where more than 80% of the population is urban.;https://www.elementascience.org/article/10.1525/elementa.293/;38;vol.6 is.1;Thomson Reuters ISI
251.0;2018;Agua y Extremos;Extremos;2018;Garreaud, R. D.;A plausible atmospheric trigger for the 2017 coastal El Niño: THE 2017 COASTAL EL NIÑO;International Journal of Climatology;"<a href=""http://bit.ly/2qVco8S"">Ver ficha</a>";10.1002/joc.5426;0899-8418;The far eastern tropical Pacific experienced a rapid, marked warming in early 2017, causing torrential rains along the west coast of South America with a significant societal toll in Peru and Ecuador. This strong coastal El Niño was largely unpredicted, even a few weeks before its onset, and it developed differently from either central or eastern events. Here we provide an overview of the event, its impacts and concomitant atmospheric circulation. It is proposed that a remotely forced, sustained weakening of the free tropospheric westerly flow impinging the subtropical Andes leads to a relaxation of the southeasterly (SE) trades off the coast, which in turn may have warmed the eastern Pacific throughout the weakening of upwelling in a near-coastal band and the lessening of the evaporative cooling farther offshore.;http://doi.wiley.com/10.1002/joc.5426;;;Thomson Reuters ISI
252.0;2018;Agua y Extremos;Extremos;2018;"Garreaud, R. D.
";"Record-breaking climate anomalies lead to severe drought and environmental disruption in western Patagonia in 2016
";"Climate Research
";"<a href=""http://bit.ly/2qSDVIa"">Ver ficha</a>";10.3354/cr01505;"0936-577X
";"Traditionally a temperate and hyper-humid region, western Patagonia experienced its most severe drought during the summer and fall of 2016. Along with precipitation deficits larger than 50% there was a similar reduction in river discharge into coastal waters, a decline in vegetation productivity, excessive solar radiation at the surface, and frequent upwelling-favorable wind events offshore. The combination of these regional-scale anomalies seems to have set the stage for environmental disturbances that, although not new in western Patagonia, occurred with unprecedented magnitude, including severe urban air pollution episodes, large forest fires, and the worst ever recorded harmful algae bloom (HAB). The local climate anomalies were in turn related to the concomitant strong El Niño (through atmospheric teleconnections) and, to a lesser extent, anthropogenic climate change mediated by the positive polarity of the Southern Annular Mode (SAM) and internal variability, as both modes weakened the westerlies. Dryer than present conditions are consistently projected for northern Patagonia during the 21st century as a consequence of anthropogenic increases in radiative forcing; superposition of El Niño events in this altered climate may result in a higher frequency of extreme droughts and environmental disruptions like those observed in 2016.";http://www.int-res.com/abstracts/cr/v74/n3/p217-229/;217-229;vol.74 is.3;Thomson Reuters ISI
253.0;2018;Gobernanza e Interfaz entre Ciencia y Política;Gobernanza;2018;Gladkova, E., Blanco-Wells, G., Nahuelhual, L.;Facing the climate change conundrum at the South Pole: actors’ perspectives on the implications of global warming for Chilean Antarctic governance;Polar Research;;10.1080/17518369.2018.1468195;1751-8369;"Antarctica is recognized as being geopolitically and scientifically important, and as one of the regions with the greatest potential to affect and be affected by global climate change. Still, little is known in practice about how climate change will be handled within the main governance framework of the continent: the Antarctic Treaty System (ATS). Using qualitative interviews, participant observations and policy document analysis, this paper explores the perspectives of Chilean scientific, political and non-governmental actors regarding the implications of climate change for the current Antarctic governance framework. Results corroborate a misalignment of the climate change agenda and the ATS, stemming from the divergent views displayed by a wide network of actors. From the interviews, two predominant visions emerge: (i) climate change as an opportunity, where actors recognize the role of Antarctica in regulating global climate and stress greater opportunities to conduct Antarctic-based climate change research, the need for strategic international collaboration, and the reinforcement of Chile’s position in Antarctica through science; (ii) climate change as a burden where actors acknowledge climate change as a global problem, largely external to Antarctica, express disbelief regarding the effectiveness of local actions to tackle climate change and do not associate with climate change governance. The study concludes that climate change may become a dividing, rather than a unifying, field of action in Chilean Antarctic governance, reinforcing previously existing geopolitical tendencies.";https://www.tandfonline.com/doi/full/10.1080/17518369.2018.1468195;1468195;vol.37 is.1;Thomson Reuters ISI
254.0;2018;Cambio de Uso de Suelo;Suelo;2018;Gómez-González, S., Ojeda, F., Fernandes, P.M.;Portugal and Chile: Longing for sustainable forestry while rising from the ashes;Environmental Science & Policy;"<a href=""http://bit.ly/2qVbcCq"">Ver ficha</a>";10.1016/j.envsci.2017.11.006;1462-9011;The recent catastrophic wildfires in Portugal and Chile shared similar features, not just because they developed under extreme weather conditions but also because extensive forest plantations were involved. Dense forest plantations of flammable pine and eucalypt species favor the development of high-intensity large fires, threatening people and the forest industry sustainability under increasingly frequent and severe drought events. Preventive land-use planning and cost-effective fuel management are key elements of sustainable forestry. Understanding the fire ecology context prior to plantation establishment is also crucial for the success of fire management planning. Although the forest industry has contributed to the economy of these countries, improved regulation and science-based management policies are strongly needed. Fuel treatment strategies can be optimized by risk-based modeling approaches, and should be mandatory in wildland-urban interfaces. The tragedy caused by these wildfires is an opportunity to change towards more sustainable landscape arrangements that reconcile ecosystem services, biodiversity conservation, and protection from life-threatening wildfires.;http://linkinghub.elsevier.com/retrieve/pii/S1462901117307694;104-107;vol.81;Thomson Reuters ISI
255.0;2018;Cambio de Uso de Suelo;Suelo;2018;Gómez-González, S., Paniw, M., Antunes, K., Ojeda, F.;Heat shock and plant leachates regulate seed germination of the endangered carnivorous plant Drosophyllum lusitanicum;Web Ecology;;10.5194/we-18-7-2018;1438-8677;"In fire-prone ecosystems, many plant species have specialized mechanisms of seed dormancy that ensure a successful recruitment after fire. A well-documented mechanism is the germination stimulated by fire-related cues, such as heat shock and smoke. However, less is known about the role of inhibitory germination signals (e.g. allelopathy) in regulating post-fire recruitment. Plant leachates derived from the unburned vegetation can enforce dormancy by means of allelopathic compounds, acting as a signal of unfavourable (highly 
competitive) niche for germination in pyrophyte species. Here, we assessed the separate effects of heat shock and plant leachates on seed germination of Drosophyllum lusitanicum , an endangered carnivorous plant endemic to Mediterranean fire-prone heathlands. We performed a germination experiment in which seeds were subjected to three treatments: (1) 5 min at 100◦C, (2) watering with plant leachate, and (3) control. Germination rate and seed viability was determined after 63 days. Heat shock stimulated seed germination in D. lusitanicum while plant leachates had inhibitory germination effects without reducing seed viability. Thus, both positive and negative signals could be involved in its successful post-fire recruitment. Fire would break seed dormancy and stimulate seed germination of D. lusitanicum through high temperatures, but also by eliminating allelochemical compounds from the soil. These results help to understand the population dynamics patterns found for D. lusitanicum in natural populations, and highlight the role of fire in the ecology and conservation of this endangered species. Seed dormancy imposed by plant-derived leachates as an adaptive mechanism should be considered more in fire ecology theory.";https://www.web-ecol.net/18/7/2018/;7-13;vol.18 is.1;Thomson Reuters ISI
256.0;2018;Ciudades Resilientes;Ciudades;2018;Gómez, C. D., González, C. M., Osses, M., Aristizábal, B. H.;Spatial and temporal disaggregation of the on-road vehicle emission inventory in a medium-sized Andean city. Comparison of GIS-based top-down methodologies;Atmospheric Environment;;10.1016/j.atmosenv.2018.01.049;1352-2310;Emission data is an essential tool for understanding environmental problems associated with sources and dynamics of air pollutants in urban environments, especially those emitted from vehicular sources. There is a lack of knowledge about the estimation of air pollutant emissions and particularly its spatial and temporal distribution in South America, mainly in medium-sized cities with population less than one million inhabitants. This work performed the spatial and temporal disaggregation of the on-road vehicle emission inventory (EI) in the medium-sized Andean city of Manizales, Colombia, with a spatial resolution of 1 km × 1 km and a temporal resolution of 1 h. A reported top-down methodology, based on the analysis of traffic flow levels and road network distribution, was applied. Results obtained allowed the identification of several hotspots of emission at the downtown zone and the residential and commercial area of Manizales. Downtown exhibited the highest percentage contribution of emissions normalized by its total area, with values equal to 6% and 5% of total CO and PM10 emissions per km2 respectively. These indexes were higher than those obtained in residential-commercial area with values of 2%/km2 for both pollutants. Temporal distribution showed strong relationship with driving patterns at rush hours, as well as an important influence of passenger cars and motorcycles in emissions of CO both at downtown and residential-commercial areas, and the impact of public transport in PM10 emissions in the residential-commercial zone. Considering that detailed information about traffic counts and road network distribution is not always available in medium-sized cities, this work compares other simplified top-down methods for spatially assessing the on-road vehicle EI. Results suggested that simplified methods could underestimate the spatial allocation of downtown emissions, a zone dominated by high traffic of vehicles. The comparison between simplified methods based on total traffic counts and road density distribution suggested that the use of total traffic counts in a simplified form could enhance higher uncertainties in the spatial disaggregation of emissions. Results obtained could add new information that help to improve the air pollution management system in the city and contribute to local public policy decisions. Additionally, this work provides appropriate resolution emission fluxes for ongoing research in atmospheric modeling in the city, with the aim to improve the understanding of transport, transformation and impacts of pollutant emissions in urban air quality.;http://linkinghub.elsevier.com/retrieve/pii/S1352231018300633;142-155;vol.179;Thomson Reuters ISI
257.0;2018;Zonas Costeras;Costas;2018;Guajardo-Leiva, S., Pedrós-Alió, C., Salgado, O., Pinto, F., Díez, B.;Active Crossfire Between Cyanobacteria and Cyanophages in Phototrophic Mat Communities Within Hot Springs;Frontiers in Microbiology;;10.3389/fmicb.2018.02039;1664-302X;"Cyanophages are viruses with a wide distribution in aquatic ecosystems, that specifically infect Cyanobacteria. These viruses can be readily isolated from marine and fresh waters environments; however, their presence in cosmopolitan thermophilic phototrophic mats remains largely unknown. This study investigates the morphological diversity (TEM), taxonomic composition (metagenomics), and active infectivity (metatranscriptomics) of viral communities over a thermal gradient in hot spring phototrophic mats from Northern Patagonia (Chile). The mats were dominated (up to 53%) by cosmopolitan thermophilic filamentous true-branching cyanobacteria from the genus Mastigocladus, the associated viral community was predominantly composed of Caudovirales (70%), with most of the active infections driven by cyanophages (up to 90% of Caudovirales transcripts). Metagenomic assembly lead to the first full genome description of a T7-like Thermophilic Cyanophage recovered from a hot spring (Porcelana Hot Spring, Chile), with a temperature of 58°C (TC-CHP58). This could potentially represent a world-wide thermophilic lineage of podoviruses that infect cyanobacteria. In the hot spring, TC-CHP58 was active over a temperature gradient from 48 to 66°C, showing a high population variability represented by 1979 single nucleotide variants (SNVs). TC-CHP58 was associated to the Mastigocladus spp. by CRISPR spacers. Marked differences in metagenomic CRISPR loci number and spacers diversity, as well as SNVs, in the TC-CHP58 proto-spacers at different temperatures, reinforce the theory of co-evolution between natural virus populations and cyanobacterial hosts. Considering the importance of cyanobacteria in hot spring biogeochemical cycles, the description of this new cyanopodovirus lineage may have global implications for the functioning of these extreme ecosystems.";https://www.frontiersin.org/article/10.3389/fmicb.2018.02039/full;;vol.9;Thomson  Reuters ISI
258.0;2018;Ciudades Resilientes;Ciudades;2018;Ibarra-Espinosa, S., Ynoue, R., O'ullivan, S., Pebesma, E., Andrade, M., Osses, M.;VEIN v0.2.2: an R package for bottom–up vehicular emissions inventories;Geoscientific Model Development;;10.5194/gmd-11-2209-2018;1991-959X;Emission inventories are the quantification of pollutants from different sources. They provide important information not only for climate and weather studies but also for urban planning and environmental health protection. We developed an open-source model (called Vehicular Emissions Inventory-VEIN v0.2.2) that provides high-resolution vehicular emissions inventories for different fields of studies. We focused on vehicular sources at street and hourly levels due to the current lack of information about these sources, mainly in developing countries. The type of emissions covered by VEIN are exhaust (hot and cold) and evaporative considering the deterioration of the factors. VEIN also performs speciation and incorporates functions to generate and spatially allocate emissions databases. It allows users to load their own emission factors, but it also provides emission factors from the road transport model (Copert), the United States Environmental Protection Agency (EPA) and Brazilian databases. The VEIN model reads, distributes by age of use and extrapolates hourly traffic data, and it estimates emissions hourly and spatially. Based on our knowledge, VEIN is the first bottom-up vehicle emissions software that allows input to the WRF-Chem model. Therefore, the VEIN model provides an important, easy and fast way of elaborating or analyzing vehicular emissions inventories under different scenarios. The VEIN results can be used as an input for atmospheric models, health studies, air quality standardizations and decision making.;https://www.geosci-model-dev.net/11/2209/2018/;2209-2229;vol.11;Thomson Reuters ISI
259.0;2018;Gobernanza e Interfaz entre Ciencia y Política;Gobernanza;2018;"Ibarra, C., O´Ryan, R., Silva, B.
";Applying knowledge governance to understand the role of science in environmental regulation: The case of arsenic in Chile;Environmental Science and Policy;;10.1016/j.envsci.2018.05.002;1462-9011;"The relationship between scientific knowledge and decision-making surrounding environmental issues is complex and represents a flourishing area of scholarship and practice. However, a sense of frustration persists regarding efforts to increase the use of science for decision-making. Regulations of copper smelter arsenic emissions developed in Chile during the 1990s represent a successful example of science informing policy making. The case involved production and use of local science in contrast to the common practice of copying international ambient standards. 
In this paper, we investigate arsenic regulation in Chile in the 1990s and focus on the role of the major science intervention during the process, project FONDEF2-24. The case is examined through the lens of knowledge governance (van Kerkhoff and Pilbeam, 2017). This theoretically-oriented approach guides our critical reflection on the relationship between knowledge and policy making, taking into consideration the formal and informal rules that shape the intervention and the underlying social and cultural patterns. The success of the science intervention’s influence on policy is better understood with such a perspective. 
We expand the knowledge governance approach by scrutinizing the relations of coherence between levels of analysis to assess their alignment. The approach could be helpful for studying other cases, particularly at times when a new field of policy is emerging.";http://linkinghub.elsevier.com/retrieve/pii/S1462901118300212;115-124;vol.86;Thomson Reuters ISI
