N;Funding Year;Línea de Investigación;Research Lines;Año;Autores;Título;Revista;Ficha de Publicación;DOI;ISSN;Abstract;Acceso;Páginas;Volumen;Index
87.0;2015;Dinámica del Clima;CD;2015;Henríquez, W. I., Moreno, P. I., Alloway, B. V., & Villarosa, G.;Vegetation and climate change, fire-regime shifts and volcanic disturbance in Chiloé Continental (43°S) during the last 10,000 years;Quaternary Science Reviews;;10.1016/j.quascirev.2015.06.017;0277-3791;The Valdivian rainforest ecoregion in Chile (35°-48°S) has a high conservation priority worldwide. These forests are also keys for social welfare as a result of their supply of timber as well as ecosystem services. Forests in the ecoregion have been extensively converted to fast growing Pinus radiata and Eucalyptus spp. plantations for timber production promoted by public policies and timber companies. This study describes the results of detailed measurements of hydrology and stream water chemistry in eight small watersheds in south central Chile, subjected to replacement of native temperate rainforest by exotic Eucalyptus plantations. In this system, watersheds have streamside buffers of native forest (SNFW) with varying widths. Results indicate that retention of SNFW counteracts hydrologic effects of Eucalyptus plantations, which are widely known to reduce water yields. A 1.4% rate of increase of the run-off coefficient for each metre of increase of SNFW was observed. In addition, a decrease in the concentrations of total nitrogen, dissolved inorganic nitrogen (DIN), nitrate-N, and different sized fractions of particulate organic matter were found in streams draining these plantations as a function of increasing SNFW. Streamside buffer widths of 17-22m for total nitrogen and DIN concentrations and ≥36m for sediments were required to provide comparable values to reference watersheds (100% native forest). The findings from this study suggest that SNFW may significantly reduce adverse effects from exotic species forestry plantations on water provision in an area of south central Chile where exotic forest plantations are rapidly expanding. © 2015 John Wiley;http://www.sciencedirect.com/science/article/pii/S0277379115300263 http://www.scopus.com/inward/record.url?eid=2-s2.0-84936875083&partnerID=tZOtx3y1;158-167;vol.123;Thomson Reuters ISI
88.0;2015;"Biogeoquímica; Modelación y Sistemas de Observación";BGQ, MOS;2015;Lambert, F., Tagliabue, A., Shaffer, G., Lamy, F., Winckler, G., Farías, L.,Gallardo, L., de Pol-Holz, R.;Dust fluxes and iron fertilization in Holocene and Last Glacial Maximum climates;Geophysical Research Letters;;10.1002/2015GL064250;0094-8276;"Biodiversity is considered to be an essential element of the Earth system, driving important ecosystem services. However, the conservation of biodiversity in a quickly changingworld is a challenging task which requires cost- efficient and precise monitoring systems. In the present study, the suitability of airborne discrete-return LiDAR data for the mapping of vascular plant species richness within a Sub-Mediterranean second growth native forest ecosystemwas examined. The vascular plant richness of four different layers (total, tree, shrub andherb richness) was modeled using twelve LiDAR-derived variables. As species richness values are typically count data, the cor- responding asymmetry and heteroscedasticity in the error distribution has to be considered. In this context,we compared the suitability of randomforest (RF) and a Generalized Linear Model (GLM)with a negative binomial error distribution. Both models were coupled with a feature selection approach to identify the most relevant LiDAR predictors and keep the models parsimonious. The results of RF and GLM agreed that the three most im- portant predictors for all four layers were altitude above sea level, standard deviation of slope and mean canopy height. Thiswas consistent with the preconception of LiDAR's suitability for estimating species richness,which is its capacity to capture three types of information: micro-topographical, macro-topographical and canopy struc- tural. Generalized LinearModels showed higher performances (r2: 0.66, 0.50, 0.52, 0.50; nRMSE: 16.29%, 19.08%, 17.89%, 21.31% for total, tree, shrub and herb richness respectively) than RF (r2: 0.55, 0.33, 0.45, 0.46; nRMSE: 18.30%, 21.90%, 18.95%, 21.00% for total, tree, shrub and herb richness, respectively). Furthermore, the results of the best GLMweremore parsimonious (three predictors) and less biased than the best RFmodels (twelve pre- dictors). We think that this is due to the mentioned non-symmetric error distribution of the species richness values, which RF is unable to properly capture. Fromanecological perspective, thepredicted patterns agreedwell with theknown vegetationcomposition of the area. We found especially high species numbers at low elevations and along riversides. In these areas, overlap- ping distributions of thermopile sclerophyllos species,water demanding Valdivian evergreen species and species growing in Nothofagus obliqua forests occur. The three main conclusions of the study are: 1) appropriatemodel selection is crucialwhenworkingwith biodiver- sitycountdata; 2) the applicationofRFfordatawithnon-symmetricerrordistributions isquestionable; and3) struc- tural and topographic information derived fromLiDAR data is useful for predicting local plant species richness. ©";http://www.scopus.com/inward/record.url?eid=2-s2.0-84938971959&partnerID=tZOtx3y1;6014-6023;vol.42 is.14;Thomson Reuters ISI
89.0;2015;Modelación y Sistemas de Observación;MOS;2015;Landais, A., Masson-Delmotte, V., Stenni, B., Selmo, E., Roche, D. M., Jouzel, J., Lambert, F., … Popp, T.;A review of the bipolar see-saw from synchronized and high resolution ice core water stable isotope records from Greenland and East Antarctica;Quaternary Science Reviews;;10.1016/j.quascirev.2015.01.031;0277-3791;Numerous ice core records are now available that cover the Last Glacial cycle both in Greenland and in Antarctica. Recent developments in coherent ice core chronologies now enable us to depict with a precision of a few centuries the relationship between climate records in Greenland and Antarctica over the millennial scale variability of the Last Glacial period. Stacks of Greenland and Antarctic water isotopic records nicely illustrate a seesaw pattern with the abrupt warming in Greenland being concomitant with the beginning of the cooling in Antarctica at the Antarctic Isotopic Maximum (AIM). In addition, from the precise estimate of chronological error bars and additional high resolution measurements performed on the EDC and TALDICE ice cores, we show that the seesaw pattern does not explain the regional variability in Antarctic records with clear two step structures occurring during the warming phase of AIM 8 and 12. Our Antarctic high resolution data also suggest possible teleconnections between changes in low latitude atmospheric circulation and Antarctic without any Greenland temperature fingerprint.;http://www.sciencedirect.com/science/article/pii/S0277379115000554;18-32;vol.114;Thomson Reuters ISI
90.0;2015;Servicios Ecosistémicos;ECO;2016;Lopatin, J., Dolos, K., Hernández, H. J., Galleguillos, M., & Fassnacht, F. E.;Comparing Generalized Linear Models and random forest to model vascular plant species richness using LiDAR data in a natural forest in central Chile;Remote Sensing of Environment;;10.1016/j.rse.2015.11.029;0034-4257;"The Antarctic Intermediate Water (AAIW) is a key player in global-scale oceanic overturning processes and an important conduit for heat, fresh water, and carbon transport. The AAIW past variability is poorly understood mainly due to the lack of sedimentary archives at intermediate water depths. We present records of benthic stable isotopes from sediments retrieved with the seafloor drill rig MARUM-MeBo at 956 m water depth off northern Chile (GeoB15016, 27°29.48′S, 71°07.58′W) that extend back to 970 ka. The sediments at this site are presently deposited at the boundary between AAIW and Pacific Deep Water (PDW). For previous peak interglacials, our results reveal similar benthic δ13C values at site GeoB15016 and of a newly generated stack of benthic δ13C from various deep Pacific cores representing the ""average PDW."" This suggests, unlike today, the absence of AAIW at the site and the presence of nearly pure PDW. In contrast, more positive δ13C values at site GeoB15016 compared to the stack imply a considerable AAIW contribution during cold phases of interglacials and especially during glacials. Besides, we used three short sediment cores to reconstruct benthic δ13C values from the AAIW core during the last glacial and found a δ13C signature similar to today's. Assuming that this was the case also for the past 970 kyr, we demonstrate that sea level changes and latitudinal migrations of the AAIW formation site can only account for about 50% of the full range of past δ13C increases at site GeoB15016 during cold periods. Other processes that could explain the remaining of the positive δ13C anomalies are increases in glacial AAIW production and/or deeper convection of the AAIW with respect to preceding interglacials. Key Points Absence of AAIW off northern Chile during past peak interglacial periods Increase advection of AAIW to the northern Chilean margin during cold periods Present and LGM AAIW production similar and the highest since 970 ka ©2013. American Geophysical Union. All Rights Reserved.";http://linkinghub.elsevier.com/retrieve/pii/S0034425715302169 http://www.sciencedirect.com/science/article/pii/S0034425715302169;200-210;vol.173;Thomson Reuters ISI
91.0;2015;Biogeoquímica;BGQ;2016;Masotti, I., Belviso, S., Bopp, L., Tagliabue, A., & Bucciarelli, E.;Effects of light and phosphorus on summer DMS dynamics in subtropical waters using a global ocean biogeochemical model;Environmental Chemistry;;10.1071/EN14265;1448-2517;Despite the great number and variety of glaciers in southern South America, in situ glacier mass-balance records are extremely scarce and glacier–climate relationships are still poorly understood in this region. Here we use the longest (>  35 years) and most complete in situ mass-balance record, available for the Echaurren Norte glacier (ECH) in the Andes at  ∼  33.5° S, to develop a minimal glacier surface mass-balance model that relies on nearby monthly precipitation and air temperature data as forcing. This basic model is able to explain 78 % of the variance in the annual glacier mass-balance record over the 1978–2013 calibration period. An attribution assessment identified precipitation variability as the dominant forcing modulating annual mass balances at ECH, with temperature variations likely playing a secondary role. A regionally averaged series of mean annual streamflow records from both sides of the Andes between  ∼  30 and 37° S is then used to estimate, through simple linear regression, this glacier's annual mass-balance variations since 1909. The reconstruction model captures 68 % of the observed glacier mass-balance variability and shows three periods of sustained positive mass balances embedded in an overall negative trend over the past 105 years. The three periods of sustained positive mass balances (centered in the 1920s–1930s, in the 1980s and in the first decade of the 21st century) coincide with several documented glacier advances in this region. Similar trends observed in other shorter glacier mass-balance series suggest that the Echaurren Norte glacier reconstruction is representative of larger-scale conditions and could be useful for more detailed glaciological, hydrological and climatological assessments in this portion of the Andes.;http://www.publish.csiro.au/paper/EN14265.htm;379-389;vol.13 is.2;Thomson Reuters ISI
92.0;2015;Servicios Ecosistémicos;ECO;2015;Miranda, A., Altamirano, A., Cayuela, L., Pincheira, F., & Lara, A.;Different times, same story: Native forest loss and landscape homogenization in three physiographical areas of south-central of Chile;Applied Geography;;10.1016/j.apgeog.2015.02.016;0143-6228;The occurrence of a summer DMS paradox in the vast subtropical gyres is a strong matter of debate because approaches using discrete measurements, climatological data and model simulations yielded contradictory results. The major conclusion of the first appraisal of prognostic ocean DMS models was that such models need to give more weight to the direct effect of environmental forcings (e.g. irradiance) on DMS dynamics to decouple them from ecological processes. Here, the relative role of light and phosphorus on summer DMS dynamics in subtropical waters is assessed using the ocean general circulation and biogeochemistry model NEMO-PISCES in which macronutrient concentrations were restored to monthly climatological data values to improve the representation of phosphate concentrations. Results show that the vertical and temporal decoupling between chlorophyll and DMS concentrations observed in the Sargasso Sea during the summer months is captured by the model. Additional sensitivity tests show that the simulated control of phosphorus on surface DMS concentrations in the Sargasso Sea is much more important than that of light. By extending the analysis to the whole North Atlantic Ocean, we show that the longitudinal distribution of DMS during summer is asymmetrical and that a correlation between the solar radiation dose and DMS concentrations only occurs in the Sargasso Sea. The lack of a widespread summer DMS paradox in our model simulation as well as in the comparison of discrete and climatological data could be due to the limited occurrence of phosphorus limitation in the global ocean.;http://www.scopus.com/inward/record.url?eid=2-s2.0-84928324890&partnerID=tZOtx3y1 http://www.sciencedirect.com/science/article/pii/S0143622815000478;20-28;vol.60;Thomson Reuters ISI
93.0;2015;"Dimensión Humana; Dinámica del Clima; Modelación y Sistemas de Observación";HD, CD, MOS;2015;Molina, L. T., Gallardo, L., Andrade, M., Baumgardner, D., Borbor- Córdova, M., Bórquez, R., Garreaud, R. D., Huneeus, N.,  Lambert, F., … Schwarz, J. P.;Pollution and its Impacts on the South American Cryosphere;Earth's Future;;10.1002/2015EF000311;2328-4277;The potential of landscapes to supply multiple benefits to society beyond commodities production has received increasing research and policy attention. Linking the concept of multifunctionality with the ecosystem services (ES) approach offers a promising avenue for producing scientific evidence to inform landscape planning, e.g., about the relative utility of land-sharing and land-sparing. However, the value for decision-making of ES-based multifunctionality assessments has been constrained by a significant conceptual and methodological dispersion. To contribute towards a cohesive framework for landscape multifunctionality, we analyse case studies of joint ES supply regarding ten criteria designed to ultimately answer four aspects: (i) the multifunctionality of what (e.g., landscapes), (ii) the type of multifunctionality (e.g., based on ES synergies), (iii) the procedure of multifunctionality assessments, and (iv) the purpose of multifunctionality. We constructed a typology of methodological approaches based on scores for criteria describing the evaluation method and the level of stakeholder participation in assessments of joint ES supply. Surveyed studies and underlying types of methodological approaches (spatial, socio-spatial, functional, spatio-functional) differed in most criteria. We illustrate the influence of methodological divergence on planning recommendations by comparing two studies employing contrasting approaches (spatial and functional) to assess the joint supply of wildlife habitat and agricultural production in the Argentine Chaco. We distinguish between a pattern-based and process-based multifunctionality, where the latter can only be detected through approaches considering the ecological processes (e.g., ES complementarities) supporting the supply of multiple ES (functional and spatio-functional). Finally, we propose an integrated approach for assessing a socially-relevant process-based multifunctionality.;http://onlinelibrary.wiley.com/doi/10.1002/2015EF000311/abstract;345-369;vol.3 is.12;Thomson Reuters ISI
94.0;2015;Dinámica del Clima;CD;2015;Moreno, P. I., Denton, G. H., Moreno, H., Lowell, T. V., Putnam, A. E., & Kaplan, M. R.;Radiocarbon chronology of the last glacial maximum and its termination in northwestern Patagonia;Quaternary Science Reviews;;10.1016/j.quascirev.2015.05.027;0277-3791;The Variability of American Monsoon Systems (VAMOS) Ocean-Cloud-Atmosphere- Land Study (VOCALS) is an international research program focused upon improved understanding and modeling of the southeast Pacific (SEP) climate system on diurnal to inter annual time scales. The SEP is characterized by strong coastal ocean upwelling, the coldest sea surface temperatures (SST) at comparable latitudes, the planet's most extensive subtropical stratocumulus deck, and a high and steep cordillera to the east. The VOCALS program is built on several research activities in SEP climate research (Mechoso and Wood 2010). The preceding Eastern Pacific Investigation of Climate Processes in the Coupled Ocean-Atmosphere System (EPIC) provided important insight on the intertropical convergence zone (ITCZ)/cold-tongue complex and marine boundary layer (MBL) clouds over the SEP.;http://www.scopus.com/inward/record.url?eid=2-s2.0-84936771311&partnerID=tZOtx3y1 http://linkinghub.elsevier.com/retrieve/pii/S0277379115300044;233-249;vol.122;Thomson Reuters ISI
95.0;2015;Dimensión Humana;HD;2015;Nahuelhual, L., Laterra, P., Villarino, S., Mastrángelo, M., Carmona, A., Jaramillo, A., … Burgos, N.;Mapping of ecosystem services: Missing links between purposes and procedures;Ecosystem Services;;10.1016/j.ecoser.2015.03.005;2212-0416;The understanding of the spatial and temporal patterns in land use and land cover (LULC) change is a key issue for conservation efforts. In the Chilean hotspot, different studies have attempted to understand variations of LULC change. Nevertheless, a broader understanding of common patterns and variability of LULC over the entire range of the hotspot is lacking. We performed a complete review of the different studies reporting LULC changes and performed a joint analysis of their results using an integrated comprehensive approach. We related the variation of LULC change to latitude, time period and vascular plant richness using generalized linear models. Overall, there were nine studies, which covered 36.5 % of the study area, and reported the loss of 19 % of native forest (782,120 ha) between 1973 and 2011. The highest net forest loss was observed in the 1970–1990 period. This decreased in the 1990–2000 period and rose again in the 2000–2010 period. This result reveals a continuous forest loss in the last 40 years. Conversion of native forest to shrublands is the most important contributor to net native forest loss, accounting for 45 % of the loss. However, in the area of greatest species richness native forests are mainly converted to exotic tree plantations. Chilean forestry model has proved successful in expanding exotic tree plantation, but so far it has not been compatible with native forest conservation and restoration. It is imperative to design a new forestry policy to assure the conservation of one of the most unique biodiversity hotspots worldwide.;http://www.sciencedirect.com/science/article/pii/S2212041615000340;162-172;vol.13;Thomson Reuters ISI
96.0;2015;Dinámica del Clima;CD;2015;Neukom, R., Rohrer, M., Calanca, P., Salzmann, N., Huggel, C., Acuña, D., Christie, D. A., … Morales, M. S.;Facing unprecedented drying of the Central Andes? Precipitation variability over the period AD 1000-2100;Environmental Research Letters;;10.1088/1748-9326/10/8/084017;1748-9326;Temperate forest represents the smallest area among the main world's forest biomes, but is one of those most threatened by forest loss. Chile contains most of the temperate forest in South America and more than half of the temperate forest in the southern hemisphere. Chilean temperate forest is considered to be one of the world's biodiversity hotspots. In this study we assessed the rate of land use and land cover (LULC) change over time, identified the main LULCs replacing native forest, and described how changes have evolved in contrasting physiographical conditions and through different historical phases of the landscape over the last 40 years. To achieve this, we analysed LULC change with particular focus on forest cover in three areas representing different physiographical conditions and histories of human occupation in the Araucanía Region of Chile, namely the Central Valley, the Coastal range, and the Andean range. We found substantial differences in temporal and intra-regional patterns of forest loss and LULC change. In the Central Valley, forest loss started long ago, and the area occupied by native forest nowadays is less than 5% of the landscape. In the Coastal range, rapid land cover change has taken place since 1973, with an increasing rate of forest loss over time. We detected a similar but less intense pattern in the forests of the Andean range. Overall, the general pattern points to a process of landscape homogenization in all three physiographical areas. Exotic tree plantations have spread over large geographical areas, becoming the dominant land cover. Land cover change in the Araucanía Region reflects a model of change in which areas with better environmental conditions and accessibility are occupied first for productive activities. As the availability of suitable areas for the expansion of productive activities diminishes, these activities start to move into physiographical areas which were previously “protected” by adverse environmental conditions or poor accessibility. This model of production growth could lead to the complete deforestation of areas outside national protected areas, and other areas which still remain inaccessible due to technological restrictions on exploitation.;http://iopscience.iop.org/article/10.1088/1748-9326/10/8/084017;art084017;vol.10 is.8;Thomson Reuters ISI
97.0;2015;Dinámica del Clima;CD;2015;Pino, P., Iglesias, V., Garreaud, R., Cortés, S., Canals, M., Folch, W., … Steenland, K.;Chile Confronts its Environmental Health Future After 25 Years of Accelerated Growth;Annals of Global Health;;10.1016/j.aogh.2015.06.008;2214-9996;The response of the tropical climate in the Indian Ocean realm to abrupt climate change events in the North Atlantic Ocean is contentious. Repositioning of the intertropical convergence zone is thought to have been responsible for changes in tropical hydroclimate during North Atlantic cold spells, but the dearth of high-resolution records outside the monsoon realm in the Indian Ocean precludes a full understanding of this remote relationship and its underlying mechanisms. Here we show that slowdowns of the Atlantic meridional overturning circulation during Heinrich stadials and the Younger Dryas stadial affected the tropical Indian Ocean hydroclimate through changes to the Hadley circulation including a southward shift in the rising branch (the intertropical convergence zone) and an overall weakening over the southern Indian Ocean. Our results are based on new, high-resolution sea surface temperature and seawater oxygen isotope records of well-dated sedimentary archives from the tropical eastern Indian Ocean for the past 45,000 years, combined with climate model simulations of Atlantic circulation slowdown under Marine Isotope Stages 2 and 3 boundary conditions. Similar conditions in the east and west of the basin rule out a zonal dipole structure as the dominant forcing of the tropical Indian Ocean hydroclimate of millennial-scale events. Results from our simulations and proxy data suggest dry conditions in the northern Indian Ocean realm and wet and warm conditions in the southern realm during North Atlantic cold spells.;http://www.ncbi.nlm.nih.gov/pubmed/26615070;354-367;vol.81 is.3;Thomson Reuters ISI
